<?xml version="1.0" encoding="UTF-8"?>

<arrowhead xmlns:xsi="http://www.w3.org/2001/XMLSchema-instance" 
xsi:noNamespaceSchemaLocation="C:\Users\mark2\OneDrive\Ambiente de Trabalho\Projeto MegaLOD\arrow-heads\MegaLOD\arrow_head.xsd"
inventory_number="2">
    <order_number>2</order_number>
    <group>2</group>
    <type>Type2</type>
    <sub_type>false</sub_type>
    <variant>6</variant>
    <raw_material>
        <typometry>
            <lenght>22</lenght>
            <width>22.36</width>
            <thickness>5</thickness>
            <body_lenght>16</body_lenght>
            <base_lenght>6</base_lenght>
        </typometry>
        <morphology>
            <point>2</point>
            <body>6</body>
            <base>8</base>
        </morphology>
        <retouch>
            <mode>sas</mode>
            <amplitude>asdas</amplitude>
            <direction>asdasd</direction>
            <delineation>asdasd</delineation>
            <orientation>asdasd</orientation>
            <location>asdas</location>
            <shape>asdas</shape>
        </retouch>
    </raw_material>
    <observations>Ponta de Seta 2 de teste</observations>
    <image_url></image_url>
</arrowhead>